{"$schema":"https://json-schema.org/draft/2020-12/schema","title":"Execution Model","type":"object","additionalProperties":false,"required":["schema_version","rule_version","execution_model_id","testcase_model_id","testcase_model_path","testcase_model_hash","validation_status","branch_count","execution_instance_count","execution_instances"],"properties":{"schema_version":{"const":"2.0.0"},"rule_version":{"type":"string"},"execution_model_id":{"type":"string","pattern":"^EXEC-MODEL-[0-9]{3}$"},"testcase_model_id":{"type":"string"},"testcase_model_path":{"type":"string"},"testcase_model_hash":{"type":"string","pattern":"^sha256:[0-9a-f]{64}$"},"validation_status":{"enum":["draft","pending","passed","failed"]},"branch_count":{"type":"integer","minimum":0},"execution_instance_count":{"type":"integer","minimum":0},"execution_instances":{"type":"array","items":{"type":"object","required":["execution_instance_id","testcase_id","branch_id","run_type","run_sequence","status","executed_at","executor","actual_result","evidence_references","defect_ids","confirmation_ids","rerun_of_execution_instance_id","notes"]}}}}
